ID,city,name,price,address,bedroom,bathroom,garage,surface_area,building_area
1,Jakarta Timur,For Sale Luxury And Elite House In The Heart Of East Jakarta With Easy Access,"Rp 5,4 Miliar","Cakung, Jakarta Timur",5,5,2 + 2,LT:  105 m²,LB:  180 m²
2,Jakarta Timur,Butuh Duit Banget,"Rp 2,9 Miliar","Jakarta Garden City, Jakarta Timur",5,3,1,LT:  112 m²,LB:  150 m²
3,Jakarta Timur,For Sale Rumah Brand New Lokasi Strategies Dekat Cempaka Putih dan Kayu Putih dan Senen Depan Rumah Dua Mobil Siap Huni Dekat Kemana Mana Area Rawamangun Jakarta Timur,"Rp 3,5 Miliar","Rawamangun, Jakarta Timur",3,3,2,LT:  90 m²,LB:  200 m²
4,Jakarta Timur,"Jual Murah Rumah 2 Lantai Premium - Cluster Thames, Jakarta Garden City 028 Co 007","Rp 1,42 MiliarRp 1.9 MTurun Rp 480 Jutaan","Cakung, Jakarta Timur",3 + 1,2 + 1,1,LT:  90 m²,LB:  75 m²
5,Jakarta Timur,Rumah Bagus Baru Dijual 3 Bedroom Lokasi Strategis Premium,"Rp 3,4 Miliar","Rawamangun, Jakarta Timur",3,2,2 + 2,LT:  105 m²,LB:  108 m²
6,Jakarta Timur,"Hunian One Stop Living Elit untuk Keluarga, Lokasi Terbaik Dekat Pusat Jakarta","Rp 5,4 Miliar","Jakarta Garden City, Jakarta Timur",5,5,1 + 1,LT:  105 m²,LB:  180 m²
7,Jakarta Timur,Termurah Rumah Rawamangun Masuk Mobil,Rp 900 JutaRp 1.2 MTurun Rp 300 Jutaan,"Rawamangun, Jakarta Timur",2,2,1 + 1,LT:  34 m²,LB:  75 m²
8,Jakarta Timur,Rumah Cluster Shinano 2Lt 10X15 150Meter 4Kt Jgc Jakarta Garden City,"Rp 2,4 Miliar","Jakarta Garden City, Jakarta Timur",4 + 1,3 + 1,2,LT:  150 m²,LB:  121 m²
9,Jakarta Timur,Hunian Mewah 3 Lantai dengan Clubhouse Bintang 5 di Jakarta,"Rp 5,4 Miliar","Duren Sawit, Jakarta Timur",5,5,2 + 2,LT:  105 m²,LB:  180 m²
10,Jakarta Timur,Dijual Rumah 2Lantai Nyaman dan Asri di Kalisari Pekayon Jakarta.timur,Rp 750 Juta,"Kalisari, Jakarta Timur",3,2,1 + 1,LT:  50 m²,LB:  60 m²
11,Jakarta Timur,New Condition Rumah Modern 2 Lantai Bagus Nyaman di Dalam Cluster,"Rp 3,4 Miliar","Pondok Kelapa, Jakarta Timur",3,2,2 + 2,LT:  105 m²,LB:  108 m²
12,Jakarta Timur,Di Jual Cepat Rumah Siap Huni Dekat Kawasan Industri Pulo Gadung,"Rp 1,12 Miliar","Pulo Gadung, Jakarta Timur",3,3,1,LT:  47 m²,LB:  73 m²
13,Jakarta Timur,Rumah Luas Megah 3 Lantai dengan 5 Kamar Tidur Dijual di Jakarta Timur Sangat Premium,"Rp 5,4 Miliar","Jakarta Garden City, Jakarta Timur",5,5,1 + 1,LT:  105 m²,LB:  180 m²
14,Jakarta Timur,Rumah Mewah di Jaktim Akses Mudah dengan Fasilitas Sangat Lengkap 3 Lantai,"Rp 5,4 Miliar","Cakung, Jakarta Timur",5,5,2 + 2,LT:  105 m²,LB:  180 m²
15,Jakarta Timur,Rumah Mewah Luas Modern Baru 4BR Kota Wisata Cibubur Strategis Free DP,"Rp 3,4 Miliar","Cibubur, Jakarta Timur",4,4,1 + 1,LT:  120 m²,LB:  149 m²
16,Jakarta Timur,Dijual Rumah Baru Nan Modern 3 Lantai di Jaktim Dekat Sekolah dan Akses Strategis,"Rp 5,4 Miliar","Cipayung, Jakarta Timur",5,5,2 + 2,LT:  105 m²,LB:  180 m²
17,Jakarta Timur,Hunian Nyaman Mewah Dijual di Metland Menteng Cakung Jakarta Timur 4 BR,"Rp 3,4 Miliar","Cakung, Jakarta Timur",3,2,2 + 2,LT:  105 m²,LB:  108 m²
18,Jakarta Timur,Rumah Baru Bagus Mewah Luas Dijual di Jaktim 3 Lantai Lokasi Strategis Bebas Banjir,"Rp 5,4 Miliar","Cakung, Jakarta Timur",5,5,2 + 2,LT:  105 m²,LB:  180 m²
19,Jakarta Timur,Rumah Mewah Modern dan Bebas Bnjir di Cluster Zebrina Jgc - Hunian Eksklusif di Jakarta Timur,"Rp 2,5 Miliar","Jakarta Garden City, Jakarta Timur",4,4,1 + 1,LT:  148 m²,LB:  156 m²
20,Jakarta Timur,Jual Rumah Premium 3 Lantai Paling Dicari di Jakarta Harga Dijamin Worth It!,"Rp 5,4 Miliar","Rawamangun, Jakarta Timur",5,5,1 + 1,LT:  105 m²,LB:  180 m²
21,Jakarta Barat,Rumah Meruya Utara 10X25 Boulevard Siap Huni,"Rp 3,9 MiliarRp 4 MTurun Rp 90 Jutaan","Meruya, Jakarta Barat",5 + 1,4 + 1,2 + 1,LT:  250 m²,LB:  400 m²
22,Jakarta Barat,Riviera @ Puri - 10X18 - Furnished - Unit Ready.,"Rp 6,3 MiliarRp 6.5 MTurun Rp 200 Jutaan","Metland Puri, Jakarta Barat",4,3,2,LT:  180 m²,LB:  211 m²
23,Jakarta Barat,"Ana Rumah Nyaman 2.25Lt Luas 8X15m Model American Classic di Komplek Meruya, Kembangan, Jakarta Barat - * Good- Deal !!*","Rp 3,2 Miliar","Meruya, Jakarta Barat",3 + 1,3 + 1,2 + 2,LT:  120 m²,LB:  198 m²
24,Jakarta Barat,"Ana Rumah Murah Luas 10X15m Harga 1M-An, Rp. 12Jt-An Perm2 di Duri Kepa, Kebon Jeruk - * Good- Deal !!*","Rp 1,9 Miliar","Duri Kepa, Jakarta Barat",3 + 1,2 + 1,2 + 2,LT:  150 m²,LB:  138 m²
25,Jakarta Barat,Ana Rumah Full Furnish di Kav Polri Luas 4.65X16m 3.5Lt Lingkungan Jelambar - * Good- Deal !!*,"Rp 2,99 MiliarRp 3.5 MTurun Rp 510 Jutaan","Jelambar, Jakarta Barat",3 + 1,4 + 1,1 + 1,LT:  74 m²,LB:  188 m²
26,Jakarta Barat,Ana Rumah Bagus 4Lt Luas 4X11m Full Furnish Design Cantik dan Interior Modern di Jelambar - * Good- Deal !!*,"Rp 2,2 Miliar","Jelambar, Jakarta Barat",3 + 1,3 + 1,1 + 1,LT:  44 m²,LB:  118 m²
27,Jakarta Barat,Hot Sale Rumah Mewah Puri Indah - Sangat Ekslusif,"Rp 27,5 Miliar","Puri Indah, Jakarta Barat",4 + 2,4 + 2,0,LT:,LB:
28,Jakarta Barat,Hot Rumah 4 Lantai Premium Jakarta Barat,Rp 9 Miliar,"Permata Buana, Jakarta Barat",5 + 1,4 + 1,1 + 2,LT:  144 m²,LB:  460 m²
29,Jakarta Barat,Jarang Ada! Rumah Kavling Polri Blok Favorite Jelambar,"Rp 2,99 MiliarRp 3.5 MTurun Rp 510 Jutaan","Jelambar, Jakarta Barat",4,4,1,LT:  74 m²,LB:  142 m²
30,Jakarta Barat,Full Furnish Modern House 5.5X19 Strategis Duri Kepa Jakarta Barat,"Rp 2,8 Miliar","Duri Kepa, Jakarta Barat",5,4,1,LT:  105 m²,LB:  225 m²
31,Jakarta Barat,Rumah 7.5X15.7 Hadap Timur Komplek Favorite Kavling Polri Jelambar Jakarta Barat,"Rp 3,35 Miliar","Jelambar, Jakarta Barat",6,3,1,LT:  117 m²,LB:  300 m²
32,Jakarta Barat,Gak Masuk Akal! Rumah Mewah Puri Indah Ini Sudah Ada Lift & Pool di Dalam,Rp 12 Miliar,"Puri Indah, Jakarta Barat",4,3,2 + 2,LT:  140 m²,LB:  400 m²
33,Jakarta Barat,Harga Masih Masuk! Rumah Cantik Semi Furnish di Cluster Favorit Green Lake City,"Rp 1,35 Miliar","Green Lake City, Jakarta Barat",2,2,1,LT:  48 m²,LB:  64 m²
34,Jakarta Barat,Dijual Rumah Milenial Brand New Permata Buana Lebar 8 4 Lantai Sudah tersedia Kitchenset,Rp 9 Miliar,"Permata Buana, Jakarta Barat",5 + 1,4 + 1,0,LT:,LB:
35,Jakarta Barat,Rumah 3 Lantai Dijual Permata Buana Ada Taman Belakang - LT 250M2,"Rp 9,9 Miliar","Permata Buana, Jakarta Barat",4 + 2,4 + 1,2 + 2,LT:  250 m²,LB:  500 m²
36,Jakarta Barat,Nego Sampai Deal.!! Rumah Hook Siap Huni SHM Furnish Citra Garden,"Rp 11,5 Miliar","Citra Garden, Jakarta Barat",5 + 1,4 + 1,2 + 8,LT:  320 m²,LB:  283 m²
37,Jakarta Barat,"Rumah Modern 3 Lantai di Puri, Lokasi Super Strategis 4 Akses Tol","Rp 3,8 Miliar","Meruya, Jakarta Barat",6 + 1,5 + 1,2 + 2,LT:  96 m²,LB:  187 m²
38,Jakarta Barat,"Rumah 3 Kamar Tidur Dekat Joglo,Meruya dan Karang Tengah Free PPN","Rp 1,8 Miliar","Villa Meruya, Jakarta Barat",3 + 1,3 + 1,2 + 2,LT:  71 m²,LB:  99 m²
39,Jakarta Barat,Rumah Brand New Puri Indah Kembangan Desain Modern Luxury - 140M2,Rp 12 Miliar,"Puri Indah, Jakarta Barat",3 + 1,3 + 3,2 + 2,LT:  140 m²,LB:  400 m²
40,Jakarta Barat,Rumah 2 Lantai Mewah Dekat Tol Meruya Puri Jakarta Barat Free PPN,"Rp 1,9 Miliar","Meruya, Jakarta Barat",3 + 1,3 + 1,2 + 2,LT:  71 m²,LB:  99 m²
41,Jakarta Selatan,"For Sale Rumah Harga Murah Lokasi Strategis Pinggir Jalan Raya bisa Cocok untuk Townhhouse, Perkantoran, Cafe, Restaurant, Kos Kosan, Hotel, Apotek atau Ruko atau Tempat Tinggal atau Multifungsi Harga Nego Sampai Deal Area Cipete Jakarta Selatan","Rp 28,9 Miliar","Cipete, Jakarta Selatan",4,2,7,LT:  916 m²,LB:  450 m²
42,Jakarta Selatan,For Sale Rumah Lama Harga Dibawah NJOP Area Komersil Lokasi Strategis bisa Multifungsi dan bisa Buat Showroom atau Bengkel atau Klinik atau Gedung atau Resto atau Cafe atau Supermarket Area Hj Nawi Cipete Kebayoran Baru Jakarta Selatan,Rp 55 Miliar,"Cipete, Jakarta Selatan",7,7,11,LT:  1800 m²,LB:  1600 m²
43,Jakarta Selatan,For Sale Rumah Mewah Baru Lokasi Tenang dan Asri Bangunan Lokasi Dekat Jis dan Bukit Golf dan Mall Pondok Indah Jakarta Selatan,Rp 40 Miliar,"Pondok Indah, Jakarta Selatan",5,5,5,LT:  627 m²,LB:  1050 m²
44,Jakarta Selatan,For Sale Rumah Lama Harga Dibawah NJOP Area Komersil Lokasi Strategis bisa Multifungsi dan bisa Buat Hotel atau Showroom atau Bengkel atau Klinik atau Gedung atau Resto atau Cafe atau Supermarket Area Hj Nawi Cipete Fatmawati Dekat Kebayoran Baru Jakarta,Rp 55 Miliar,"Kebayoran Baru, Jakarta Selatan",7 + 1,7 + 3,10,LT:  1800 m²,LB:  1600 m²
45,Jakarta Selatan,For Sale Rumah Murah Dekat MRT dan Fatmawati dan Cipete Raya dan Sekolah Internasional dan Kemang dan Kebayoran Baru Area Cipete Jakarta Selatan,"Rp 9,5 Miliar","Cipete, Jakarta Selatan",5,3,4,LT:  463 m²,LB:  310 m²
46,Jakarta Selatan,"For Sale Rumah atau Kantor Cocok Dibangun Hotel, atau Restoran Mewah atau Gedung atau Ruang Usaha Cafe atau Kantor atau Klinik atau Lainnya Area Prime Dekat Blok M dan Mabes dan Wijaya Area Kebayoran Baru Jakarta Selatan",Rp 55 Miliar,"Kebayoran Baru, Jakarta Selatan",6,5,12,LT:  1165 m²,LB:  452 m²
47,Jakarta Selatan,For Sale Cepat Rumah Murah Tanah Luas Harga Murah Lokasi Strategis Area Pejaten Barat Kemang Jakarta Selatan,"Rp 7,5 Miliar","Pejaten, Jakarta Selatan",3,2,4,LT:  404 m²,LB:  250 m²
48,Jakarta Selatan,For Salerumah Modern Dalam Townhouse Lokasi Dekat Sekolah Internasional dan Kemang Raya Area Kemang Jakarta Selatan,Rp 16 Miliar,"Kemang, Jakarta Selatan",4,3,4,LT:  412 m²,LB:  400 m²
49,Jakarta Selatan,For Sale Rumah Lama Tanah Luas bisa Bangun Rumah atau Mini Townhouse atau Tempat Tinggal Dekat Sekolah Internasional dan Dekat Kuliner dan MRT Cipete Harga Murah Area Cipete Jakarta Selatan,Rp 22 Miliar,"Cipete, Jakarta Selatan",5,3,4,LT:  931 m²,LB:  325 m²
50,Jakarta Selatan,For Sale Rumah Mewah Cantik Dalam Compound Lokasi Nyaman dan Asri Area Pejaten Dekat Kemang Jakarta Selatan,Rp 32 Miliar,"Pejaten, Jakarta Selatan",5,4,5,LT:  1230 m²,LB:  650 m²
51,Jakarta Selatan,For Sale House Mewah Modern Lokasi Dekat Blok M dan Mabes dan Perkantoran Area Kebayoran Baru Jakarta Selatan,Rp 32 Miliar,"Kebayoran Baru, Jakarta Selatan",5,4,4,LT:  346 m²,LB:  400 m²
52,Jakarta Selatan,For Sale Rumah Murah Harga Murah Lokasi Strategis Kemang Raya dan Ampera dan Pejaten dan Cocok untuk Investasi Area Pejaten Kemang Jakarta Selatan,"Rp 7,5 Miliar","Kemang, Jakarta Selatan",3,2,4,LT:  404 m²,LB:  250 m²
53,Jakarta Selatan,"Rumah Lux Lokasi Premier Depan Taman Pondok Indah, Jakarta Selatan",Rp 53 Miliar,"Pondok Indah, Jakarta Selatan",5 + 4,5 + 2,10 + 10,LT:  1100 m²,LB:  1200 m²
54,Jakarta Selatan,Rumah Mewah Modern Tropical Style Kebayoran Baru,Rp 45 Miliar,"Kebayoran Baru, Jakarta Selatan",5 + 1,4 + 1,2 + 3,LT:  888 m²,LB:  800 m²
55,Jakarta Selatan,Dijual Murah Se NJOP di Kemang Timur Raya. Luas 1344M2,Rp 30 Miliar,"Kemang, Jakarta Selatan",3,4,2 + 12,LT:  1344 m²,LB:  500 m²
56,Jakarta Selatan,Rumah di Jual Cepat Lebak Bulus,"Rp 5,8 Miliar","Lebak Bulus, Jakarta Selatan",4 + 1,3 + 1,1 + 1,LT:  305 m²,LB:  250 m²
57,Jakarta Selatan,Rumah Siap Huni Dikawasan Elit Bintaro. Harga 1 M-An,"Rp 1,3 Miliar","Bintaro, Jakarta Selatan",3,2,1,LT:  63 m²,LB:  69 m²
58,Jakarta Selatan,Dijual Rumah 3 Bedroom di Cilandak Luas dan Strategis Dekat Mall Toll Rs Kampus,"Rp 1,9 Miliar","Cilandak, Jakarta Selatan",3,2,1 + 1,LT:  74 m²,LB:  60 m²
59,Jakarta Selatan,Hot Jual Murah Rumah Mewah 2 Lantai di Pondok Indah,Rp 26 Miliar,"Pondok Indah, Jakarta Selatan",7 + 1,5 + 1,3 + 3,LT:  425 m²,LB:  750 m²
60,Jakarta Selatan,Dijual Murah Rumah di Keluarahan Selong (Kebayorab Baru Area Senopati) Luas 1050M2 Dalam Portal Hanya Rp 70 Milyar Nego,Rp 79 Miliar,"Kebayoran Baru, Jakarta Selatan",6,4,3 + 6,LT:  1050 m²,LB:  600 m²
61,Jakarta Utara,"Dijual Rumah Cantik di Lokasi Premier Danau Sunter, Full Furnish","Rp 8,25 MiliarRp 10.5 MTurun Rp 2.2 Miliaran","Sunter, Jakarta Utara",4 + 1,5 + 1,1 + 2,LT:  300 m²,LB:  500 m²
62,Jakarta Utara,Cash / KPR - Rumah Pik2 10X20 [4+1 Kamar Tidur],"Rp 7,2 Miliar","Pantai Indah Kapuk 2, Jakarta Utara",4 + 1,4 + 1,2,LT:  200 m²,LB:  224 m²
63,Jakarta Utara,Turun Harga - Rumah Bgm 12X25 Pik 1 Full Furnish Interior Mewah - Unit Langka Segera Terjual!,"Rp 11,8 MiliarRp 12.9 MTurun Rp 1.1 Miliaran","Pantai Indah Kapuk, Jakarta Utara",7 + 2,7 + 2,2 + 2,LT:  300 m²,LB:  555 m²
64,Jakarta Utara,Rumah Sunter SHM,Rp 5 MiliarRp 5.5 MTurun Rp 500 Jutaan,"Sunter, Jakarta Utara",3,3,0,LT:,LB:
65,Jakarta Utara,Rumah Sunter Siap Huni dengan Kolam Renang,"Rp 8,5 Miliar","Sunter, Jakarta Utara",4,5,0,LT:,LB:
66,Jakarta Utara,Rumah Sunter Hadap Timur,"Rp 5,5 Miliar","Sunter, Jakarta Utara",5,5,0,LT:,LB:
67,Jakarta Utara,Rumah Sunter Hadap Selatan Siap Huni,"Rp 3,25 MiliarRp 3.4 MTurun Rp 200 Jutaan","Sunter, Jakarta Utara",4,3,0,LT:,LB:
68,Jakarta Utara,Rumah Golf Island Cluster Violin Furnish,"Rp 12,3 MiliarRp 14 MTurun Rp 1.7 Miliaran","Pantai Indah Kapuk, Jakarta Utara",7,6,0,LT:,LB:
69,Jakarta Utara,Rumah Sunter Hadap Selatan,"Rp 2,35 MiliarRp 2.4 MTurun Rp 50 Jutaan","Sunter, Jakarta Utara",4,3,0,LT:,LB:
70,Jakarta Utara,Rumah Golf Island Semi Furnish,Rp 11 Miliar,"Pantai Indah Kapuk, Jakarta Utara",4,3,0,LT:,LB:
71,Jakarta Utara,Rumah Sunter Hadap Timur,"Rp 7,3 MiliarRp 7.5 MTurun Rp 200 Jutaan","Sunter, Jakarta Utara",4,3,0,LT:,LB:
72,Jakarta Utara,Rumah Sunter Furnish,Rp 5 MiliarRp 6.1 MTurun Rp 1.1 Miliaran,"Sunter, Jakarta Utara",6,3,0,LT:,LB:
73,Jakarta Utara,Dijual Rumah Huk Mewah di Pik Sangat Homey,Rp 15 Miliar,"Pantai Indah Kapuk, Jakarta Utara",5,6,2 + 2,LT:  390 m²,LB:  1000 m²
74,Jakarta Utara,Rumah Mewah Minimalis Sunter Sts Nego Sampai Jadi,Rp 8 MiliarRp 8.5 MTurun Rp 500 Jutaan,"Sunter, Jakarta Utara",5,5,1 + 2,LT:  192 m²,LB:  500 m²
75,Jakarta Utara,Rumah Agung Permai Minimalis Rumah Sunter Agung Permai Minimalis,"Rp 4,7 Miliar","Sunter, Jakarta Utara",4,4,1 + 1,LT:  180 m²,LB:  180 m²
76,Jakarta Utara,Rumah Sunter Siap Huni Nego Sampai Jadi,"Rp 6,1 Miliar","Sunter, Jakarta Utara",3,2,1 + 1,LT:  204 m²,LB:  290 m²
77,Jakarta Utara,Rumah Sunter Paradise 2 Rumah Sunter Minimalis Rumah Minimalis Sunter Rumah Sunter Paradise Rumah Sts Rumah Garden Rumah Agung Permai,"Rp 7,2 MiliarRp 7.5 MTurun Rp 300 Jutaan","Sunter, Jakarta Utara",4,4,2 + 2,LT:  190 m²,LB:  522 m²
78,Jakarta Utara,Promo Free PPN - Rumah 8X20 Golf Island Brand New bisa KPR - Segera Terjual!,"Rp 5,4 Miliar","Golf Island, Jakarta Utara",3 + 1,3 + 1,2,LT:  160 m²,LB:  174 m²
79,Jakarta Utara,"Jual Cepat, Rumah Minimalis Semi Furnish Bebas Banjir di Sunter Agung, Nego","Rp 4,45 Miliar","Sunter, Jakarta Utara",5 + 1,5 + 1,2,LT:  119 m²,LB:  252 m²
80,Jakarta Utara,Direct Jogging Track. Backyard Area. Struktur Rumah Terjaga dengan Baik. Langka. Jarang Ada. Ada Halaman Depan. Rumah Sangat2 Asri. Row Jalan Sangat2 Lebar. Hadap Tidak Tepat Selatan Lebih ke Arah Tenggara. Fully Furnish,Rp 29 Miliar,"Pantai Indah Kapuk, Jakarta Utara",4,5,2 + 4,LT:  525 m²,LB:  440 m²
81,Jakarta Utara,Turun Harga Rumah 8X15 Pik 2 Tahap 1 Termurah Pasti Terjual Bulan Ini - Welcome Investor,"Rp 3,9 MiliarRp 4 MTurun Rp 100 Jutaan","Pantai Indah Kapuk 2, Jakarta Utara",4 + 1,3 + 1,2,LT:  120 m²,LB:  200 m²
82,Jakarta Pusat,For Sale House Dalam Bentuk Kost Kostan dan Terisi Rumah bisa untuk Kantor atau Tempat Tinggal atau Multifungsi atau Klinik Area Premium Menteng Jakarta Pusat,Rp 55 Miliar,"Menteng, Jakarta Pusat",6,6,5,LT:  629 m²,LB:  700 m²
83,Jakarta Pusat,"Jual Cepat, Rumah Luxury 2Lantai Siap Huni di Menteng",Rp 20 Miliar,"Menteng, Jakarta Pusat",8 + 1,8 + 1,3 + 2,LT:  537 m²,LB:  1100 m²
84,Jakarta Pusat,Dijual Rumah Springhill Kemayoran Siap Huni Furnished,"Rp 6,9 Miliar","Kemayoran, Jakarta Pusat",5,4,1 + 3,LT:  153 m²,LB:  525 m²
85,Jakarta Pusat,Hunian Premium Luas Harga Terjangkau Dijual Kondisi Baru dengan 3 Lantai,"Rp 6,5 Miliar","Menteng, Jakarta Pusat",5,5,2 + 2,LT:  120 m²,LB:  223 m²
86,Jakarta Pusat,Rumah Cantik Lokasi Strategis di Percetakan Negara Jakarta Pusat,"Rp 1,07 Miliar","Percetakan Negara, Jakarta Pusat",2,2,1,LT:  31 m²,LB:  59 m²
87,Jakarta Pusat,"Compound Unit Mewah Siap Huni di Menteng Jakarta Pusat Rumah Bagus SHM di Jl. H.o.s. Cokroaminoto No 6, Gondangdia, Menteng, Kota Jakarta Pusat, Dki Jakarta, Indonesia, 10350, Menteng","Rp 54,5 MiliarRp 57.5 MTurun Rp 3 Miliaran","Menteng, Jakarta Pusat",10,10,4 + 2,LT:  629 m²,LB:  505 m²
88,Jakarta Pusat,Jual Rumah Kondisi Baru Mewah Luas di Jakarta Fasilitas Lengkap 5 Kamar,"Rp 6,5 Miliar","Cempaka Putih, Jakarta Pusat",5,5,2 + 2,LT:  120 m²,LB:  223 m²
89,Jakarta Pusat,KPR Rumah Akses Mobil Cempaka Putih,Rp 990 JutaRp 1.1 MTurun Rp 110 Jutaan,"Cempaka Putih, Jakarta Pusat",2,2,1,LT:  31 m²,LB:  60 m²
90,Jakarta Pusat,2 Lantai KPR Siap Huni Kemayoran Lokasi Pinggir Jalan,"Rp 1,7 Miliar","Kemayoran, Jakarta Pusat",2,2,1 + 1,LT:  96 m²,LB:  110 m²
91,Jakarta Pusat,KPR Rumah Mewah Cempaka Putih,"Rp 3,5 Miliar","Cempaka Putih, Jakarta Pusat",4,4,1 + 1,LT:  92 m²,LB:  172 m²
92,Jakarta Pusat,Rumah bisa KPR Cempaka Putih,"Rp 1,6 MiliarRp 1.8 MTurun Rp 200 Jutaan","Cempaka Putih, Jakarta Pusat",3,3,1 + 1,LT:  61 m²,LB:  120 m²
93,Jakarta Pusat,(Kpr) Rumah 2 Lantai Akses Mobil Jakarta,Rp 995 Juta,"Cempaka Putih, Jakarta Pusat",3,3,1 + 1,LT:  27 m²,LB:  75 m²
94,Jakarta Pusat,Rumah Minimalis Non Carport Jakarta Pusat,Rp 480 Juta,"Cempaka Putih, Jakarta Pusat",2,2,1,LT:  22 m²,LB:  50 m²
95,Jakarta Pusat,Rumah Siap Huni Percetakan Negara Salemba,"Rp 1,35 Miliar","Cempaka Putih, Jakarta Pusat",4,3,1,LT:  69 m²,LB:  110 m²
96,Jakarta Pusat,Rumah di Jual 2 LT Jl Lagura Dekat Kuliner Taman Solo Jakarta Pusat,"Rp 1,47 MiliarRp 1.8 MTurun Rp 300 Jutaan","Cempaka Putih, Jakarta Pusat",3,3,1,LT:  42 m²,LB:  72 m²
97,Jakarta Pusat,Dijual Cepat Rumah di Benhil Cocok untuk Hunian atau Kantor,Rp 13 Miliar,"Bendungan Hilir, Jakarta Pusat",6,4,2 + 2,LT:  520 m²,LB:  348 m²
98,Jakarta Pusat,Jarang Ada! Rumah Mewah 3 Lantai New Condition Ada Premium Clubhouse,"Rp 6,5 Miliar","Menteng, Jakarta Pusat",5,5,2 + 2,LT:  120 m²,LB:  223 m²
99,Jakarta Pusat,Sale! Rumah Scandinivian Dekat Radjak Hospital Salemba Jakarta Pusat,"Rp 1,07 Miliar","Salemba, Jakarta Pusat",3,2,1 + 1,LT:  25 m²,LB:  73 m²
100,Jakarta Pusat,Hunian Minimalis Ala Scandinavia di Percetakan Negara-Jakpus,"Rp 1,29 Miliar","Percetakan Negara, Jakarta Pusat",3,2,1 + 1,LT:  35 m²,LB:  68 m²
101,Jakarta Pusat,Exlusive Living! Rumah Modern Premium di Cempaka Putih Tengah,"Rp 2,53 Miliar","Cempaka Putih, Jakarta Pusat",3,3,1 + 1,LT:  54 m²,LB:  78 m²
18,Jakarta Timur,Rumah di Jual Deket Perkantoran Rawamangun,Rp 1 Miliar,"Rawamangun, Jakarta Timur",3 + 1,3 + 1,1 + 1,LT:  46 m²,LB:  73 m²
53,Jakarta Selatan,Jual Rumah 2 Lantai 3 KT Kondisi Baru Dekat MRT Lebak Bulus,"Rp 1,4 MiliarRp 1.5 MTurun Rp 100 Jutaan","Lebak Bulus, Jakarta Selatan",3,2,1 + 1,LT:  47 m²,LB:  50 m²
54,Jakarta Selatan,Rumah Besar dan Mewah Siap Huni Dalam Kompleks Hook Private di Jakarta Selatan Rumah Bagus SHM di Lebak Bulus,Rp 18 Miliar,"Lebak Bulus, Jakarta Selatan",5,3,2 + 5,LT:  999 m²,LB:  600 m²
55,Jakarta Selatan,"Luxurious Brand New House Full Furnished Desain American Classic di Kemang, Jakarta Selatan",Rp 38 Miliar,"Kemang, Jakarta Selatan",6,6,7 + 3,LT:  517 m²,LB:  760 m²
56,Jakarta Selatan,Rumah Pondok Indah Nego Tipis Lokasi Bagus,Rp 24 Miliar,"Pondok Indah, Jakarta Selatan",4 + 2,4 + 1,2 + 2,LT:  425 m²,LB:  500 m²
57,Jakarta Selatan,Rumah Tropical Minimalis di Pondok Indah,"Rp 19,8 Miliar","Pondok Indah, Jakarta Selatan",3 + 1,3 + 2,2 + 2,LT:  410 m²,LB:  350 m²
58,Jakarta Selatan,"2 Lantai,","Rp 1,3 Miliar","Lebak Bulus, Jakarta Selatan",3,3,2,LT:  60 m²,LB:  80 m²
59,Jakarta Selatan,"Di Cilandak,","Rp 1,3 Miliar","Cilandak, Jakarta Selatan",3,3,2 + 1,LT:  61 m²,LB:  80 m²
107,Jakarta Timur,Rumah 2 Lantai di Duren Sawit. Selangkah ke Stasiun Buaran,"Rp 2,1 Miliar","Cipinang, Jakarta Timur",3,3,2,LT:  92 m²,LB:  110 m²
108,Jakarta Timur,Jarang Ada! Rumah di Duren Sawit | Selangkah ke Mall Buaran,"Rp 2,2 Miliar","Pondok Kelapa, Jakarta Timur",4,4,0,LT:,LB:
109,Jakarta Timur,Di Jual Rumah Murah 2 Lantai Mewah dan Bagus Rawamangun Jakarta Timur,"Rp 1,59 Miliar","Rawamangun, Jakarta Timur",3,3,1 + 1,LT:  48 m²,LB:  74 m²
110,Jakarta Timur,Rumah Nyaman.security 24 Jam.dekat Pintu Toll,Rp 13 MiliarRp 13.5 MTurun Rp 500 Jutaan,"Bambu Apus, Jakarta Timur",5,4,2 + 4,LT:  1120 m²,LB:  500 m²
111,Jakarta Timur,Rumah Terawat Zona Komersial di Jl Persahabatan Cipinang Jaktim,"Rp 19,2 MiliarRp 20.9 MTurun Rp 1.7 Miliaran","Rawamangun, Jakarta Timur",4,4,4,LT:  1150 m²,LB:  470 m²
112,Jakarta Timur,Rumah 2 Lantai Pinggir Jalan Raya 400 Meter Stasiun Klender,"Rp 1,49 Miliar","Cipinang, Jakarta Timur",3,2,1,LT:  40 m²,LB:  63 m²
113,Jakarta Timur,Rumah 2 Lantai Pinggir Jalan Raya Ciracas Strategis,"Rp 1,25 Miliar","Ciracas, Jakarta Timur",3,2,1,LT:  56 m²,LB:  90 m²
114,Jakarta Timur,Rumah Dijual Murah Munjul Cipayung Jaktim,Rp 279 Juta,"Cipayung, Jakarta Timur",1,1,0,LT:,LB:
115,Jakarta Timur,Rumah Under 1 M Dekat Rs Persahabatan,Rp 970 Juta,"Cipinang, Jakarta Timur",2,2,1 + 1,LT:  32 m²,LB:  55 m²
116,Jakarta Timur,Rumah Murah Cluster Kayumanis Dekat Pasar Pramuka Jakarta Timur,Rp 526 Juta,"Matraman, Jakarta Timur",2,2,0,LT:,LB:
117,Jakarta Timur,Best Deal Turun Harga di Bawah Pasaran Modern Premium Asya Matana - Jgc Jakarta Timur,"Rp 4,88 MiliarRp 5.1 MTurun Rp 220 Jutaan","Jakarta Garden City, Jakarta Timur",6,5,2,LT:  153 m²,LB:  250 m²
118,Jakarta Timur,Hiden Gem! Rumah Mewah Hanya 5Menit ke LRT,Rp 950 Juta,"Cibubur, Jakarta Timur",3,2,1,LT:  60 m²,LB:  70 m²
119,Jakarta Timur,Jual Cepat Rumah Cluster La Seine Jgc,"Rp 1,5 Miliar","Jakarta Garden City, Jakarta Timur",3,2,0,LT:,LB:
120,Jakarta Timur,Rumah Siap Huni Akses Motor dan Hanya 20 Meter ke Jalan Mobil tersedia Pilihan Satu Lantai dan Dua Lantai dengan Lokasi Strategis di Cilangkap Jakarta Timur,Rp 340 JutaRp 350 JTTurun Rp 10 Jutaan,"Cipayung, Jakarta Timur",2,1,1 + 1,LT:  33 m²,LB:  45 m²
121,Jakarta Utara,Super Mewah Rumah Eksklusif Camar Pik 1 Furnished,"Rp 17,4 Miliar","Pantai Indah Kapuk, Jakarta Utara",4 + 1,2 + 1,1 + 3,LT:  345 m²,LB:  1035 m²
